{
  "schema": "studio.bench.single-attempt-journal.v1",
  "attempt_id": "bench-attempt:sha256:8f70da579b7ccedbf7c2041418c248f3ff15f7830d98552788687ac1ed996d21",
  "head_commit": "a09c6f46a3769f73a8a8412de5f643f35c32e04e",
  "charge": {
    "path": "bench/attempts/rule-change-ko-kinship-address-context-provider-authorized-c2-r3-without/charge.json",
    "content_id": "sha256:cf605a82242811c0ccf0cbcb7a77f8b5ea2e2d9483d3049068510906dfc0508f",
    "bytes": 875
  }
}
